{
  "$schema": "../../../schemas/work-item.schema.json",
  "id": "008",
  "title": "RSS And Trusted Signals Adapter",
  "status": "deferred",
  "owner_scope": "data",
  "affected_scopes": ["data", "backend", "ui", "docs", "security", "agent-channel"],
  "depends_on": ["007"],
  "acceptance_criteria": [
    {"id": "AC-1", "text": "ForgeLink supports local RSS/trusted signal subscriptions with feed identity, fetch interval, enabled state, last fetch status, and bounded retention.", "state": "pending", "evidence": []},
    {"id": "AC-2", "text": "Signals are persisted separately from SMS conversations and agent messages, with migration, backup/export, retention, and recovery behavior.", "state": "pending", "evidence": []},
    {"id": "AC-3", "text": "The UI presents signals as a bounded, intentional reading surface with pause/mute/archive controls and no infinite feed, ranking algorithm, likes, follows, or engagement mechanics.", "state": "pending", "evidence": []},
    {"id": "AC-4", "text": "Feed fetching is secure and bounded: timeouts, size limits, content-type handling, external URL opening rules, and no automatic execution of feed content.", "state": "pending", "evidence": []},
    {"id": "AC-5", "text": "The old PySide/Qt RSS app is located if available and reviewed for importable subscriptions or useful behavior; if unavailable, the search and decision are documented.", "state": "pending", "evidence": []},
    {"id": "AC-6", "text": "Tests cover feed parsing, duplicate item handling, failed fetch states, retention, export/backup, UI separation, and notification boundaries.", "state": "pending", "evidence": []}
  ],
  "created": "2026-06-15",
  "updated": "2026-06-15"
}
