{
  "$schema": "../../../schemas/work-item.schema.json",
  "id": "009",
  "title": "Human Attention Policy",
  "status": "deferred",
  "owner_scope": "agent-channel",
  "affected_scopes": ["agent-channel", "ui", "desktop", "backend", "data", "docs", "security"],
  "depends_on": ["007", "008"],
  "acceptance_criteria": [
    {"id": "AC-1", "text": "ForgeLink has a central attention policy model covering SMS, agent channels, and trusted signals with defaults that avoid unnecessary interruption.", "state": "pending", "evidence": []},
    {"id": "AC-2", "text": "The policy supports quiet hours, urgency behavior, source/channel mute states, notification body redaction, and explicit overrides.", "state": "pending", "evidence": []},
    {"id": "AC-3", "text": "Desktop notifications use the policy and never include message bodies, phone numbers, secrets, personal media, or agent-human transcript content unless the human explicitly enables that behavior.", "state": "pending", "evidence": []},
    {"id": "AC-4", "text": "Settings UI lets the human inspect and adjust attention rules without hidden ranking or engagement controls.", "state": "pending", "evidence": []},
    {"id": "AC-5", "text": "Policy decisions are testable and covered by unit tests across SMS, agent messages, urgent approvals, RSS/signals, muted sources, quiet hours, and failure states.", "state": "pending", "evidence": []},
    {"id": "AC-6", "text": "Docs explain the attention model, privacy defaults, and remaining risks for local notifications and future mobile/remote bridges.", "state": "pending", "evidence": []}
  ],
  "created": "2026-06-15",
  "updated": "2026-06-15"
}
