{
  "$schema": "../../../schemas/work-item.schema.json",
  "id": "030",
  "title": "Tauri Shared Shell and Electron Retirement",
  "status": "completed",
  "owner_scope": "work",
  "affected_scopes": [
    "work",
    "desktop",
    "ui",
    "mobile",
    "local-runtime",
    "security",
    "release",
    "docs",
    "tooling"
  ],
  "depends_on": [
    "011",
    "015",
    "016",
    "017"
  ],
  "preflight": {
    "created_before_work_started": true,
    "created_at": "2026-06-27T15:00:00Z",
    "note": "Created before Tauri implementation work starts. Captures the operator decision to make Tauri 2 the target shared desktop/mobile shell and retire Electron after parity."
  },
  "acceptance_criteria": [
    {
      "id": "TAURI-001",
      "text": "Record the Tauri 2 target architecture: one shared React/Web UI for desktop and a full mobile cockpit (mobile layout), Rust-native shell logic, platform plugins where needed, desktop as source of truth at this stage, the decision terminal as a restricted mobile mode/profile (decision 0017), and Electron treated as a temporary compatibility shell.",
      "state": "satisfied",
      "evidence": [
        "20260703-tauri001-002-architecture-bridge"
      ]
    },
    {
      "id": "TAURI-002",
      "text": "Introduce a narrow app-bridge abstraction so renderer code does not directly depend on Electron APIs for local service control, notifications, secure storage, deep links, updater/distribution hooks, or mobile decision actions.",
      "state": "satisfied",
      "evidence": [
        "20260703-tauri001-002-architecture-bridge"
      ]
    },
    {
      "id": "TAURI-003",
      "text": "Scaffold a Tauri 2 desktop shell alongside Electron using the existing React renderer, with parity smoke tests for startup, authenticated local API access, settings/onboarding entry, notifications, and the Decisions/People/Agents/Channels cockpit.",
      "state": "satisfied",
      "evidence": [
        "20260703-tauri003-005-shell-scaffold"
      ]
    },
    {
      "id": "TAURI-004",
      "text": "Define and implement the Tauri 2 mobile cockpit for Android/iOS: the shared cockpit in a mobile layout as a full operator control surface where the platform reasonably allows it, reading the operator's data as an authenticated client (not a replicated private database), with the paired/redacted/signed decision terminal (alerts, approval cards, approve/deny/defer/request-more-info/short-reply, presence, emergency toggle, device revoke) preserved as a restricted mode/profile rather than the whole app (decision 0017).",
      "state": "satisfied",
      "evidence": [
        "20260703-tauri003-005-shell-scaffold"
      ]
    },
    {
      "id": "TAURI-005",
      "text": "Define the Electron retirement gate: Tauri must cover onboarding, local service lifecycle, credential storage, notifications, deep links, updates/distribution, diagnostics, data safety, and existing desktop workflows before Electron is removed.",
      "state": "satisfied",
      "evidence": [
        "20260703-tauri003-005-shell-scaffold"
      ]
    },
    {
      "id": "TAURI-006",
      "text": "Define the signed distribution and update strategy for Tauri desktop and mobile targets, coordinating with work item 011 PR-014 and work item 017 OCX-020 so release work does not deepen the Electron-only path. Signed public distribution is a later hardening step gated on the operator-provided certificate (decision 0018); unsigned/dev builds are acceptable for near-term scaffolding and validation and do not block the other TAURI criteria.",
      "state": "satisfied",
      "evidence": [
        "20260703-tauri006-distribution-update-strategy"
      ]
    },
    {
      "id": "TAURI-007",
      "text": "Add automated validation for the shared-shell bridge and Tauri targets, including renderer interaction tests, desktop shell smoke tests, mobile decision-flow tests or documented emulator/device evidence, and rollback notes.",
      "state": "satisfied",
      "evidence": [
        "20260703-tauri007-validation-rollback",
        "20260703-tauri007-android-emulator-smoke"
      ]
    },
    {
      "id": "TAURI-008",
      "text": "Add the Android/Fabric operator-status consumer for the mobile cockpit path: a typed AndroidOperatorStatus payload, a fixture captured from the live ROM lab bridge, a pure parse/normalize client that treats ok:false and malformed payloads as degraded, and an advisory read-only 'Android / Fabric Device Health' panel that never grants authority or triggers actions.",
      "state": "satisfied",
      "evidence": [
        "20260629-tauri008-operator-status-consumer"
      ]
    },
    {
      "id": "TAURI-009",
      "text": "Add a launch-only operator-status transport endpoint (GET /api/device/operator-status) that runs the operator-configured ROM lab wrapper with a strictly-validated request_id through an execFile arg array (no shell string), timeout-bounded, returning the bridge JSON or a degraded ok:false body. Read-only, advisory, not MCP-reachable, with no raw device/shell surface; the mobile cockpit panel uses it for live status.",
      "state": "satisfied",
      "evidence": [
        "20260629-tauri009-operator-status-transport",
        "20260629-tauri009-operator-status-live-smoke"
      ]
    }
  ],
  "created": "2026-06-27",
  "updated": "2026-07-10"
}
