{
  "$schema": "../../../schemas/work-item.schema.json",
  "id": "017",
  "title": "Operator Cockpit and Native Experience",
  "status": "completed",
  "owner_scope": "work",
  "affected_scopes": [
    "work",
    "backend",
    "desktop",
    "ui",
    "data",
    "security",
    "mcp",
    "mobile",
    "agents",
    "contacts",
    "policy",
    "docs",
    "demo",
    "tooling"
  ],
  "depends_on": [
    "015",
    "016"
  ],
  "preflight": {
    "created_before_work_started": true,
    "created_at": "2026-06-18T17:06:00Z",
    "note": "Created before implementation work starts for ForgeLink operator cockpit and native product experience."
  },
  "acceptance_criteria": [
    {
      "id": "OCX-001",
      "text": "Define decision-first navigation around Decisions, People, Agents, and Channels so action-required decisions are not buried inside ordinary conversations.",
      "state": "satisfied",
      "evidence": [
        "20260627-ocx001-decision-first-navigation"
      ]
    },
    {
      "id": "OCX-002",
      "text": "Add triage lanes for needs decision, waiting on agent, informational, failed/needs repair, muted, expired, and completed states.",
      "state": "satisfied",
      "evidence": [
        "20260627-ocx002-003-triage-relationship-grouping"
      ]
    },
    {
      "id": "OCX-003",
      "text": "Add relationship-aware grouping for operator, family, trusted humans, external contacts, agents, systems, unknown, and blocked entities.",
      "state": "satisfied",
      "evidence": [
        "20260627-ocx002-003-triage-relationship-grouping"
      ]
    },
    {
      "id": "OCX-004",
      "text": "Add operator availability modes such as available, focus, driving, sleeping, family, work, emergency-only, and offline that affect routing/redaction/batching/escalation.",
      "state": "satisfied",
      "evidence": [
        "20260627-ocx004-006-operator-modes-presence-emergency"
      ]
    },
    {
      "id": "OCX-005",
      "text": "Add privacy-preserving local presence signals such as app focus, idle, battery, network, DND, paired mobile proximity, and approved calendar integration where applicable.",
      "state": "satisfied",
      "evidence": [
        "20260627-ocx004-006-operator-modes-presence-emergency"
      ]
    },
    {
      "id": "OCX-006",
      "text": "Add emergency/crisis rules including emergency contact bypass, repeated urgent escalation, agent emergency impersonation prevention, safety-sensitive handling, and local-only fail-safe behavior.",
      "state": "satisfied",
      "evidence": [
        "20260627-ocx004-006-operator-modes-presence-emergency"
      ]
    },
    {
      "id": "OCX-007",
      "text": "Define Tauri-first mobile decision terminal MVP UX as a paired human decision terminal with redacted alerts, approval cards, approve/deny, short reply, presence signal, emergency toggle, and device revoke, using the shared cockpit UI direction from work item 030.",
      "state": "satisfied",
      "evidence": [
        "20260628-ocx007-008-mobile-decision-terminal"
      ]
    },
    {
      "id": "OCX-008",
      "text": "Add Tauri mobile decision terminal flow design for signed approve/deny/defer/request-more-info/short-reply decisions returning to desktop through the shared UI/bridge model without full private database replication.",
      "state": "satisfied",
      "evidence": [
        "20260628-ocx007-008-mobile-decision-terminal"
      ]
    },
    {
      "id": "OCX-009",
      "text": "Add batch approvals with approve all, approve selected, deny all, and inspect individual items while preserving individual audit/outcome records.",
      "state": "satisfied",
      "evidence": [
        "20260628-ocx009-011-interruption-cost"
      ]
    },
    {
      "id": "OCX-010",
      "text": "Add human fatigue budget tracking interruptions, urgent interruptions, denials, expirations, response time, and repeated interruptions by agent to recommend batching/deferring/muting.",
      "state": "satisfied",
      "evidence": [
        "20260628-ocx009-011-interruption-cost"
      ]
    },
    {
      "id": "OCX-011",
      "text": "Add agent reputation UI using approvals, denials, expired requests, malformed requests, failed outcomes, modified-scope attempts, and repeated urgent requests without silently granting authority.",
      "state": "satisfied",
      "evidence": [
        "20260628-ocx009-011-interruption-cost"
      ]
    },
    {
      "id": "OCX-012",
      "text": "Add local semantic thread summaries for what happened, open decisions, pending replies, last human action, and agent-relevant constraints as derived artifacts.",
      "state": "satisfied",
      "evidence": [
        "20260629-ocx012-019-013-thread-summaries"
      ]
    },
    {
      "id": "OCX-013",
      "text": "Add scoped MCP resources such as pending approvals, contact summary, thread summary, and agent status while preventing raw communication dumps by default.",
      "state": "satisfied",
      "evidence": [
        "20260629-ocx012-019-013-thread-summaries"
      ]
    },
    {
      "id": "OCX-014",
      "text": "Add reviewed outbox for agent-drafted external messages with review, edit, approve, deny, schedule, and send behavior.",
      "state": "satisfied",
      "evidence": [
        "20260629-ocx014-015-018-outbox-sample"
      ]
    },
    {
      "id": "OCX-015",
      "text": "Add channel redaction previews so operators can see what each channel will reveal before dispatch.",
      "state": "satisfied",
      "evidence": [
        "20260629-ocx014-015-018-outbox-sample"
      ]
    },
    {
      "id": "OCX-016",
      "text": "Build a reproducible synthetic killer demo showing a ForgeWire/Codex release approval, evidence pack, mobile redacted alert, operator approval, agent publish, outcome record, and replay.",
      "state": "satisfied",
      "evidence": [
        "20260629-ocx016-killer-demo"
      ]
    },
    {
      "id": "OCX-017",
      "text": "Add public-facing screenshots and narrative positioning ForgeLink as human-boundary infrastructure rather than a Twilio app, using synthetic/redacted data.",
      "state": "satisfied",
      "evidence": [
        "20260629-ocx017-narrative-screenshots"
      ]
    },
    {
      "id": "OCX-018",
      "text": "Add optional first-run sample workspace with fake contacts, fake agents, fake approvals, fake outcomes, and fake channel states that cannot be confused with real data.",
      "state": "satisfied",
      "evidence": [
        "20260629-ocx014-015-018-outbox-sample"
      ]
    },
    {
      "id": "OCX-019",
      "text": "Make local semantic summaries (OCX-012) injection-resistant: treat thread and agent content as untrusted, use injection-resistant prompting, show clear provenance, keep summaries advisory only, and never let summarized content elevate authority or trigger actions.",
      "state": "satisfied",
      "evidence": [
        "20260629-ocx012-019-013-thread-summaries"
      ]
    },
    {
      "id": "OCX-020",
      "text": "Define the distribution and update strategy for the expanded surface: code-signed desktop releases with an auto-update channel and a signed build/update path for the Tauri 2 mobile decision terminal, as a prerequisite for shipping the mobile surface (OCX-007/008) and the public demo; coordinate with item 011 PR-014 and item 030 TAURI-006.",
      "state": "satisfied",
      "evidence": [
        "20260629-ocx020-distribution-strategy"
      ]
    },
    {
      "id": "OCX-021",
      "text": "Align the operator cockpit UI with the Tauri 2 shared desktop/mobile shell by keeping renderer code behind a ForgeLink-owned bridge boundary and avoiding new direct Electron assumptions before Phase 1 expands modes, presence, and mobile flows.",
      "state": "satisfied",
      "evidence": [
        "20260627-ocx021-shared-shell-bridge"
      ]
    }
  ],
  "created": "2026-06-18",
  "updated": "2026-06-29"
}
