{
  "$schema": "../../../schemas/work-item.schema.json",
  "id": "010",
  "title": "Work Item Preflight Guardrails",
  "status": "completed",
  "owner_scope": "work",
  "affected_scopes": ["work", "tooling", "governance", "evidence"],
  "depends_on": ["008", "009"],
  "preflight": {
    "created_before_work_started": true,
    "created_at": "2026-06-16T14:20:00Z",
    "note": "Created before changing work ledger, schemas, or validators for this process fix."
  },
  "acceptance_criteria": [
    {"id": "AC-1", "text": "The work ledger states that numbered work must be created before implementation starts.", "state": "satisfied", "evidence": ["20260616-work-item-preflight-guardrails"]},
    {"id": "AC-2", "text": "Repository validation checks a machine-readable preflight marker on new work items.", "state": "satisfied", "evidence": ["20260616-work-item-preflight-guardrails"]},
    {"id": "AC-3", "text": "Existing completed work remains valid through explicit legacy handling, while new work items must carry the preflight marker.", "state": "satisfied", "evidence": ["20260616-work-item-preflight-guardrails"]},
    {"id": "AC-4", "text": "Closeout evidence documents the original miss for 008/009 and the new protection.", "state": "satisfied", "evidence": ["20260616-work-item-preflight-guardrails"]}
  ],
  "created": "2026-06-16",
  "updated": "2026-06-16"
}
